{
  "schema_version": "coh.splunk-parser-decision/v1",
  "contract_version": "1.0.0",
  "decision_id": "018f0000-0000-7000-8000-000000000003",
  "query_id": "018f0000-0000-7000-8000-000000000001",
  "outcome": "accepted",
  "reason_codes": [],
  "validator_version": "splunk-parser-1.0.0",
  "actor_id": "018f0000-0000-7000-8000-000000000002",
  "scope_digest": "sha256:1000000000000000000000000000000000000000000000000000000000000001",
  "query_digest": "sha256:1000000000000000000000000000000000000000000000000000000000000002",
  "capability_digest": "sha256:1000000000000000000000000000000000000000000000000000000000000003",
  "schema_digest": "sha256:1000000000000000000000000000000000000000000000000000000000000004",
  "plan_digest": "sha256:1000000000000000000000000000000000000000000000000000000000000005",
  "registry_digest": "sha256:1000000000000000000000000000000000000000000000000000000000000006",
  "parser_receipt_digest": "sha256:1000000000000000000000000000000000000000000000000000000000000007",
  "policy_decision_digest": "sha256:1000000000000000000000000000000000000000000000000000000000000008",
  "audit_reservation_digest": "sha256:1000000000000000000000000000000000000000000000000000000000000009",
  "observed_at": "2026-08-27T12:00:00.000000000Z",
  "valid_until": "2026-08-27T12:05:00.000000000Z",
  "digest": "sha256:dd1eade832803231b1a4c5e75e251422cfff881ea7ac49cd11a573182eb4d414"
}
